<?xml version="1.0" encoding="UTF-8"?>

<prof:profil
    xmlns:xsi='http://www.w3.org/2001/XMLSchema-instance'
    xmlns:prof='http://myGame/tux'
    xsi:schemaLocation='http://myGame/tux ../xsd/profil.xsd'>
    
    <prof:nom>martine</prof:nom>
    <prof:avatar>martine.jpg</prof:avatar>
    <prof:anniversaire>1991-08-16</prof:anniversaire>
    <prof:parties>
        <prof:partie date="2022-10-04" trouvé="100%">
            <prof:temps>59</prof:temps>
            <prof:niveau valeur="5">
                <prof:mot>mangouste</prof:mot>
            </prof:niveau>
        </prof:partie>
        <prof:partie date="2022-10-04" trouvé="100%">
            <prof:temps>59</prof:temps>
            <prof:niveau valeur="2">
                <prof:mot>zebre</prof:mot>
            </prof:niveau>
        </prof:partie>
    </prof:parties>
</prof:profil>

