<?xml version="1.0" encoding="UTF-8" standalone="no"?>
<prof:profil xmlns:prof="http://myGame/tux" xmlns:xsi="http://www.w3.org/2001/XMLSchema-instance" xsi:schemaLocation="http://myGame/tux ../xsd/profil.xsd">
    <prof:nom>alice</prof:nom>
    <prof:avatar>alice.jpg</prof:avatar>
    <prof:anniversaire>1111-11-11</prof:anniversaire>
    <prof:parties>
        <prof:partie date="2022-12-05" trouvÃ©="100%">
            <prof:temps>12</prof:temps>
            <prof:niveau valeur="1">
                <prof:mot>souris</prof:mot>
            </prof:niveau>
        </prof:partie>
    </prof:parties>
</prof:profil>
